{
  "name": "PlayerThruster_L",
  "totalDuration": 30.0,
  "loop": true,
  "primitives": [
    {
      "displayName": "Plume",
      "meshType": 4,
      "cylinderParams": {
        "topRadius": 0.096,
        "bottomRadius": 0.0288,
        "height": 1.08,
        "divisions": 24,
        "topColor": [
          0.45,
          0.8,
          1.0,
          0.9
        ],
        "bottomColor": [
          0.2,
          0.45,
          1.0,
          0.0
        ],
        "startAngle": 0.0,
        "endAngle": 6.2831853
      },
      "offset": [
        0.0,
        -0.54,
        0.0
      ],
      "startTime": 0.0,
      "lifetime": 30.0,
      "texturePath": "Resources/Textures/Effect/gradationLine.dds",
      "blendMode": 2,
      "billboardMode": "None",
      "depthWrite": false,
      "cullBackface": false,
      "uvAutoScroll": true,
      "uvScrollSpeed": [
        1.7,
        0.0
      ],
      "useBloom": true,
      "bloomIntensity": 2.6
    },
    {
      "displayName": "Plume",
      "meshType": 4,
      "cylinderParams": {
        "topRadius": 0.0504,
        "bottomRadius": 0.012,
        "height": 0.54,
        "divisions": 24,
        "topColor": [
          1.0,
          1.0,
          1.0,
          1.0
        ],
        "bottomColor": [
          0.6,
          0.9,
          1.0,
          0.0
        ],
        "startAngle": 0.0,
        "endAngle": 6.2831853
      },
      "offset": [
        0.0,
        -0.27,
        0.0
      ],
      "startTime": 0.0,
      "lifetime": 30.0,
      "texturePath": "Resources/Textures/Effect/gradationLine.dds",
      "blendMode": 2,
      "billboardMode": "None",
      "depthWrite": false,
      "cullBackface": false,
      "uvAutoScroll": true,
      "uvScrollSpeed": [
        -2.3,
        0.0
      ],
      "useBloom": true,
      "bloomIntensity": 3.3800000000000003
    },
    {
      "displayName": "NozzleGlow",
      "meshType": 0,
      "startTime": 0.0,
      "lifetime": 30.0,
      "startScale": [
        0.36,
        0.36,
        1.0
      ],
      "endScale": [
        0.36,
        0.36,
        1.0
      ],
      "startColor": [
        0.55,
        0.85,
        1.0,
        0.85
      ],
      "endColor": [
        0.55,
        0.85,
        1.0,
        0.85
      ],
      "texturePath": "Resources/Textures/Effect/circle.dds",
      "blendMode": 2,
      "billboardMode": "Full",
      "depthWrite": false,
      "useBloom": true,
      "bloomIntensity": 2.6
    }
  ],
  "particles": [],
  "lights": [],
  "sounds": []
}