{
  "name": "PlayerEtherAscend",
  "totalDuration": 0.1,
  "loop": true,
  "primitives": [],
  "particles": [
    {
      "displayName": "EtherMotes",
      "gpuParticleGroupName": "ether_motes",
      "texturePath": "Resources/Textures/circle.dds",
      "offset": [0, 0.9, 0],
      "startTime": 0,
      "duration": 0.1,
      "burstCount": 6,
      "billboardMode": "Full",
      "blendMode": 2,
      "colorMode": 1,
      "startColor": [1, 1, 1, 1],
      "endColor": [1, 1, 1, 0],
      "scaleMin": [0.02, 0.02],
      "scaleMax": [0.06, 0.06],
      "uniformScale": true,
      "startScale": 1,
      "endScale": 0.3,
      "emitRadius": 0.45,
      "particleLifeTime": 1.6,
      "velocityMode": 1,
      "velocityDir": [0, 1, 0],
      "velocitySpeed": 1.4,
      "velocityJitter": 0.35,
      "useBloom": true,
      "bloomIntensity": 2.0
    },
    {
      "displayName": "EtherSparkles",
      "gpuParticleGroupName": "ether_sparkles",
      "texturePath": "Resources/Textures/Effect/sparkles_00.dds",
      "offset": [0, 0.9, 0],
      "startTime": 0,
      "duration": 0.1,
      "burstCount": 2,
      "billboardMode": "Full",
      "blendMode": 2,
      "colorMode": 1,
      "startColor": [1, 1, 1, 1],
      "endColor": [1, 1, 1, 0],
      "scaleMin": [0.06, 0.06],
      "scaleMax": [0.14, 0.14],
      "uniformScale": true,
      "startScale": 0.4,
      "endScale": 1,
      "emitRadius": 0.4,
      "particleLifeTime": 1.2,
      "velocityMode": 1,
      "velocityDir": [0, 1, 0],
      "velocitySpeed": 2.2,
      "velocityJitter": 0.3,
      "useBloom": true,
      "bloomIntensity": 2.5
    }
  ],
  "lights": [],
  "sounds": []
}
