{
  "name": "TitleLogoRipple",
  "totalDuration": 2.0,
  "loop": false,
  "primitives": [
    {
      "displayName": "LogoRipple",
      "meshType": 0,
      "ringParams": {
        "outerRadius": 1.5,
        "innerRadius": 0.5,
        "divisions": 32,
        "innerColor": [
          1,
          1,
          1,
          1
        ],
        "outerColor": [
          1,
          1,
          1,
          1
        ],
        "startAngle": 0,
        "endAngle": 6.2831854820251465
      },
      "cylinderParams": {
        "topRadius": 1,
        "bottomRadius": 1,
        "height": 3,
        "divisions": 32,
        "topColor": [
          1,
          1,
          1,
          1
        ],
        "bottomColor": [
          1,
          1,
          1,
          1
        ],
        "startAngle": 0,
        "endAngle": 6.2831854820251465
      },
      "helixParams": {
        "startHelixRadius": 0.30000001192092896,
        "endHelixRadius": 0.30000001192092896,
        "startTubeRadius": 0.05000000074505806,
        "endTubeRadius": 0.05000000074505806,
        "pitch": 1,
        "turns": 5,
        "circleSegments": 8,
        "lengthSegments": 64,
        "startColor": [
          1,
          1,
          1,
          1
        ],
        "endColor": [
          1,
          0.30000001192092896,
          0,
          0.20000000298023224
        ]
      },
      "beamParams": {
        "startPos": [
          0,
          0,
          0
        ],
        "endPos": [
          0,
          0,
          1
        ],
        "lengthSegments": 16,
        "appearance": {
          "startWidth": 0.30000001192092896,
          "endWidth": 0.30000001192092896,
          "planeCount": 3,
          "fadeStartLength": 0.20000000298023224,
          "fadeEndLength": 0.20000000298023224,
          "startColor": [
            1,
            1,
            1,
            1
          ],
          "endColor": [
            1,
            1,
            1,
            1
          ],
          "uvWrapByLength": true,
          "uvTilesPerUnit": 1
        }
      },
      "lightningParams": {
        "startPos": [
          0,
          0,
          0
        ],
        "endPos": [
          0,
          0,
          1
        ],
        "generations": 5,
        "maxOffsetRatio": 0.15000000596046448,
        "randomSeed": 0,
        "branchProbability": 0.15000000596046448,
        "branchLengthScale": 0.25,
        "branchMaxAngle": 0.6000000238418579,
        "branchWidthScale": 0.5,
        "branchColorScale": 0.5,
        "appearance": {
          "startWidth": 0.30000001192092896,
          "endWidth": 0.30000001192092896,
          "planeCount": 3,
          "fadeStartLength": 0.20000000298023224,
          "fadeEndLength": 0.20000000298023224,
          "startColor": [
            1,
            1,
            1,
            1
          ],
          "endColor": [
            1,
            1,
            1,
            1
          ],
          "uvWrapByLength": true,
          "uvTilesPerUnit": 1
        }
      },
      "frameParams": {
        "outerWidth": 1,
        "outerHeight": 1,
        "innerWidth": 0.5,
        "innerHeight": 0.5,
        "color": [
          1,
          1,
          1,
          1
        ]
      },
      "offset": [
        0,
        0,
        0
      ],
      "rotate": [
        0,
        0,
        0
      ],
      "randomRotateOnSpawn": false,
      "randomRotateRange": [
        0,
        0,
        0
      ],
      "rotateSpeed": [
        0,
        0,
        0
      ],
      "startTime": 0,
      "lifetime": 2.0,
      "startScale": [
        0.5,
        0.5,
        0.5
      ],
      "endScale": [
        9.0,
        9.0,
        9.0
      ],
      "startColor": [
        1,
        1,
        1,
        0
      ],
      "endColor": [
        1,
        1,
        1,
        0
      ],
      "scaleCurve": {
        "enabled": false,
        "points": [
          [
            0,
            0
          ],
          [
            1,
            1
          ]
        ]
      },
      "hueShiftEnable": false,
      "hueShiftSpeed": 0.20000000298023224,
      "usePositionAnim": false,
      "startPos": [
        0,
        0,
        0
      ],
      "endPos": [
        0,
        0,
        0
      ],
      "posCurve": {
        "enabled": false,
        "points": [
          [
            0,
            0
          ],
          [
            1,
            1
          ]
        ]
      },
      "texturePath": "",
      "blendMode": 2,
      "timeGroup": 0,
      "billboardMode": "Full",
      "depthWrite": false,
      "alphaReference": 0,
      "cullBackface": false,
      "samplerMode": 2,
      "viewAngleFadePower": 0,
      "uvAutoScroll": false,
      "uvScrollSpeed": [
        0,
        0
      ],
      "uvOffset": [
        0,
        0
      ],
      "uvScale": [
        1,
        1
      ],
      "uvFlipU": false,
      "uvFlipV": false,
      "useDistortion": true,
      "distortionTexturePath": "Resources/Textures/NormalMapTexture/TitleRippleNormal.dds",
      "distortionStrength": 0.6,
      "distortionUvAutoScroll": false,
      "distortionUvScrollSpeed": [
        0,
        0
      ],
      "distortionUvOffset": [
        0,
        0
      ],
      "distortionUvScale": [
        1,
        1
      ],
      "distortionUvFlipU": false,
      "distortionUvFlipV": false,
      "useDissolve": false,
      "dissolveMaskPath": "",
      "dissolveInEnable": false,
      "dissolveInStartTime": 0,
      "dissolveInDuration": 0.5,
      "dissolveOutEnable": false,
      "dissolveOutStartTime": 0,
      "dissolveOutDuration": 0.5,
      "dissolveCurve": {
        "enabled": false,
        "points": [
          [
            0,
            0
          ],
          [
            1,
            1
          ]
        ]
      },
      "dissolveEdgeEnable": false,
      "dissolveEdgeColor": [
        1,
        0.4000000059604645,
        0.10000000149011612,
        1
      ],
      "dissolveEdgeWidth": 0.05000000074505806,
      "distortionStrengthAnim": true,
      "distortionEndStrength": 0.0
    }
  ],
  "particles": [],
  "lights": [],
  "sounds": []
}