{
  "name": "PlayerFeatherBurn",
  "totalDuration": 1.6,
  "loop": false,
  "primitives": [],
  "particles": [
    {
      "displayName": "FeatherBurnA",
      "gpuParticleGroupName": "feather_burn_00",
      "texturePath": "Resources/Textures/Effect/Feathers_00.dds",
      "startTime": 0,
      "duration": 0.05,
      "burstCount": 1,
      "billboardMode": "None",
      "blendMode": 1,
      "colorMode": 1,
      "startColor": [1, 1, 1, 1],
      "endColor": [1, 1, 1, 1],
      "scaleMin": [0.12, 0.12],
      "scaleMax": [0.28, 0.28],
      "uniformScale": true,
      "emitRadius": 0.15,
      "particleLifeTime": 1.4,
      "velocityMode": 2,
      "velocitySpeed": 0.5,
      "velocityJitter": 0.4,
      "randomRotateOnSpawn": true,
      "randomRotateRange": [3.1415927, 3.1415927, 3.1415927],
      "rotateSpeed": [1.2, 2.0, 0.8],
      "useDissolve": true,
      "dissolveMaskPath": "Resources/Textures/MaskTexture/noise0.dds",
      "dissolveOutEnable": true,
      "dissolveOutStart": 0.25,
      "dissolveEdgeEnable": true,
      "dissolveEdgeColor": [1.0, 0.45, 0.08, 1],
      "dissolveEdgeWidth": 0.08
    },
    {
      "displayName": "FeatherBurnB",
      "gpuParticleGroupName": "feather_burn_01",
      "texturePath": "Resources/Textures/Effect/Feathers_01.dds",
      "startTime": 0,
      "duration": 0.05,
      "burstCount": 1,
      "billboardMode": "None",
      "blendMode": 1,
      "colorMode": 1,
      "startColor": [1, 1, 1, 1],
      "endColor": [1, 1, 1, 1],
      "scaleMin": [0.12, 0.12],
      "scaleMax": [0.26, 0.26],
      "uniformScale": true,
      "emitRadius": 0.15,
      "particleLifeTime": 1.4,
      "velocityMode": 2,
      "velocitySpeed": 0.5,
      "velocityJitter": 0.4,
      "randomRotateOnSpawn": true,
      "randomRotateRange": [3.1415927, 3.1415927, 3.1415927],
      "rotateSpeed": [-1.6, 1.4, 1.0],
      "useDissolve": true,
      "dissolveMaskPath": "Resources/Textures/MaskTexture/noise0.dds",
      "dissolveOutEnable": true,
      "dissolveOutStart": 0.2,
      "dissolveEdgeEnable": true,
      "dissolveEdgeColor": [1.0, 0.45, 0.08, 1],
      "dissolveEdgeWidth": 0.08
    },
    {
      "displayName": "FeatherBurnC",
      "gpuParticleGroupName": "feather_burn_02",
      "texturePath": "Resources/Textures/Effect/Feathers_02.dds",
      "startTime": 0,
      "duration": 0.05,
      "burstCount": 1,
      "billboardMode": "None",
      "blendMode": 1,
      "colorMode": 1,
      "startColor": [1, 1, 1, 1],
      "endColor": [1, 1, 1, 1],
      "scaleMin": [0.1, 0.1],
      "scaleMax": [0.22, 0.22],
      "uniformScale": true,
      "emitRadius": 0.15,
      "particleLifeTime": 1.4,
      "velocityMode": 2,
      "velocitySpeed": 0.5,
      "velocityJitter": 0.3,
      "randomRotateOnSpawn": true,
      "randomRotateRange": [3.1415927, 3.1415927, 3.1415927],
      "rotateSpeed": [0.9, -1.8, 1.3],
      "useDissolve": true,
      "dissolveMaskPath": "Resources/Textures/MaskTexture/noise0.dds",
      "dissolveOutEnable": true,
      "dissolveOutStart": 0.3,
      "dissolveEdgeEnable": true,
      "dissolveEdgeColor": [1.0, 0.45, 0.08, 1],
      "dissolveEdgeWidth": 0.08
    }
  ],
  "lights": [],
  "sounds": []
}
